{"case_id":"drift_A_to_B","coordinate_system":"meters; floor=y0; rear=positive_z","edges":[{"feeder_id":"F1","rack_id":"N1"},{"feeder_id":"F1","rack_id":"N2"},{"feeder_id":"F2","rack_id":"N3"},{"feeder_id":"F2","rack_id":"N4"}],"feeders":[{"anchor_x_m":-0.45,"anchor_y_m":2.24,"feeder_id":"F1","limit_a":44.0,"style":"blue"},{"anchor_x_m":-0.45,"anchor_y_m":2.02,"feeder_id":"F2","limit_a":50.0,"style":"orange"}],"hotspot":{"rack_id":"N4","sigma_m":0.062,"surface":"rear_connector","temperature_c":88.95030198217694},"notes":["Synthesized from historical SLD and rear thermal inspection."],"racks":[{"body_temp_c":29.5,"center_x_m":0.0,"connector_side":"rear","connector_temp_c":36.0,"depth_m":1.0,"height_m":2.0,"rack_id":"N1","width_m":0.6},{"body_temp_c":26.5,"center_x_m":0.82,"connector_side":"rear","connector_temp_c":25.0,"depth_m":1.0,"height_m":2.0,"rack_id":"N2","width_m":0.6},{"body_temp_c":26.5,"center_x_m":1.64,"connector_side":"rear","connector_temp_c":25.0,"depth_m":1.0,"height_m":2.0,"rack_id":"N3","width_m":0.6},{"body_temp_c":38.0,"center_x_m":2.46,"connector_side":"rear","connector_temp_c":88.95030198217694,"depth_m":1.0,"height_m":2.0,"rack_id":"N4","width_m":0.6}],"schema_version":"scene_spec.v1","source_revision":"A","viewport":{"camera_pose":"rear_inspection","height_px":800,"width_px":1280}}